ITAG,logFC,logCPM,PValue,SGN_annotation,AGI,symbol,gene_name,X..identity,alignment.length,e.value,bit.score,percent.query.alignSolyc06g034220.2.1,2.708281421,5.077991377,1.77E-05,Vesicle-associated membrane protein-associated protein (AHRD V1 ***- Q1ANA7_WHEAT); contains Interpro domain(s)  IPR016763  Vesicle-associated membrane protein ,AT3G60600,(AT)VAP,Encodes VAP27 (for Vesicle-Associated Protein).  VAP27 has high homology to the VAP33 family of SNARE-like proteins from animals.  May be involved in vesicular transport to or from the ER.  Located exclusively in limiting membrane of protein storage vacuoles. Binds SRC2.,56.19,194,5.00E-56,214,78.94736842Solyc06g034290.2.1,-6.308714039,3.514332634,0.000287008,"Glycerol-3-phosphate transporter (AHRD V1 **** A0PYC4_CLONN); contains Interpro domain(s)  IPR016196  Major facilitator superfamily, general substrate transporter ",AT3G47420,ATPS3,"glycerol-3-phosphate transporter, putative / glycerol 3-phosphate permease, putative; similar to transporter, putative [Arabidopsis thaliana] (TAIR:AT4G25220.1); similar to putative Glycerol-3-phosphate transporter [Oryza sativa (japonica cultivar-group)] (GB:BAC99502.1); similar to Os04g0555300 [Oryza sativa (japonica cultivar-group)] (GB:NP_001053515.1); similar to putative glycerol 3-phosphate permease [Zea mays] (GB:AAS82603.1); contains InterPro domain Major facilitator superfamily; (InterPro:IPR007114); contains InterPro domain Major facilitator superfamily MFS_1; (InterPro:IPR011701)",68.9,508,0,681,97.65166341Solyc06g034390.1.1,1.603145949,4.050933281,0.02191543,Expressed protein (Fragment) (AHRD V1 ***- B3VJP0_POPTN); contains Interpro domain(s)  IPR006766  Phosphate-induced protein 1 conserved region ,AT5G51550,EXL3,phosphate-responsive 1 family protein; similar to phosphate-responsive 1 family protein [Arabidopsis thaliana] (TAIR:AT2G17230.1); similar to unknown [Sorghum bicolor] (GB:AAQ06267.1); contains InterPro domain Phosphate-induced protein 1 conserved region; (InterPro:IPR006766),74.77,333,8.00E-136,480,95.10086455Solyc06g035580.2.1,1.831333286,3.251414356,0.038912799,Choline dehydrogenase (AHRD V1 ***- C0G363_9RHIZ); contains Interpro domain(s)  IPR012132  Glucose-methanol-choline oxidoreductase ,AT5G51950,NA,glucose-methanol-choline (GMC) oxidoreductase family protein; similar to glucose-methanol-choline (GMC) oxidoreductase family protein [Arabidopsis thaliana] (TAIR:AT5G51930.1); similar to glucose-methanol-choline (GMC) oxidoreductase family protein [Arabidopsis thaliana] (TAIR:AT3G56060.1); similar to putative mandelonitrile lyase [Oryza sativa (japonica cultivar-group)] (GB:BAD29242.1); similar to Os04g0573100 [Oryza sativa (japonica cultivar-group)] (GB:NP_001053612.1); contains InterPro domain GMC oxidoreductase; (InterPro:IPR007867); contains InterPro domain Glucose-methanol-choline oxidoreductase; (InterPro:IPR000172); contains InterPro domain Alcohol oxidase; (InterPro:IPR012132),58.17,557,5.00E-174,607,94.86725664Solyc06g036290.2.1,3.93673884,5.557795177,3.48E-10,"Heat shock protein 90 (Fragment) (AHRD V1 **-- Q00NU9_WHEAT); contains Interpro domain(s)  IPR003594  ATP-binding region, ATPase-like  IPR001404  Heat shock protein Hsp90 ",AT5G52640,ATHS83,"Arabidopsis thaliana 81 kDA heat shock protein. Sequence analysis revealed that the exons are interrupted by the presence of three introns of 315, 83, and 88 base pairs. 88% similar to HSP81-2 at amino acid level.",90.37,602,0,1011,98.68421053Solyc06g036780.2.1,1.902330431,4.508398986,0.002980046,"Os01g0708300 protein (Fragment) (AHRD V1 *-*- Q0JJY9_ORYSJ); contains Interpro domain(s)  IPR000620  Protein of unknown function DUF6, transmembrane ",AT5G11960,NA,"similar to permease-related [Arabidopsis thaliana] (TAIR:AT4G13800.1); similar to hypothetical protein MtrDRAFT_AC152551g11v1 [Medicago truncatula] (GB:ABE86250.1); contains InterPro domain Protein of unknown function DUF6, transmembrane; (InterPro:IPR000620)",72.59,343,1.00E-122,436,99.13043478Solyc06g043140.2.1,2.081965319,3.872175357,0.005897525,Autophagy protein 5 (AHRD V1 ***- Q3MQ01_MAIZE); contains Interpro domain(s)  IPR007239  Autophagy-related  protein 5 ,AT5G17290,APG5,"Autophagy protein ATG5. Forms a conjugate with ATG12 with an essential role in plant nutrient recycling. Mutants missing ATG5 display early senescence and are hypersensitive to nitrogen or carbon starvation, accompanied by a more rapid loss of organellar and cytoplasmic proteins.",55.37,354,7.00E-109,390,97.65395894Solyc06g048570.2.1,-2.691171176,3.238654967,0.007313248,Hydrolase alpha/beta fold family protein expressed (AHRD V1 **-- Q2QYJ1_ORYSJ); contains Interpro domain(s)  IPR000073  Alpha/beta hydrolase fold-1 ,AT3G10870,ATMES17,"hydrolase, alpha/beta fold family protein; similar to hydrolase, alpha/beta fold family protein [Arabidopsis thaliana] (TAIR:AT5G58310.1); similar to Os12g0117100 [Oryza sativa (japonica cultivar-group)] (GB:NP_001065997.1); similar to Os11g0118000 [Oryza sativa (japonica cultivar-group)] (GB:NP_001065594.1); similar to pheophorbidase [Raphanus sativus] (GB:BAE54383.1); contains InterPro domain Esterase/lipase/thioesterase; (InterPro:IPR000379); contains InterPro domain Alpha/beta hydrolase fold-1; (InterPro:IPR000073)",62.02,258,6.00E-93,337,90.03558719Solyc06g048900.1.1,3.133757236,4.74156586,2.35E-06,Pentatricopeptide repeat-containing protein (AHRD V1 ***- D7KZF9_ARALY); contains Interpro domain(s)  IPR002885  Pentatricopeptide repeat ,AT2G40720,NA,pentatricopeptide (PPR) repeat-containing protein; similar to pentatricopeptide (PPR) repeat-containing protein [Arabidopsis thaliana] (TAIR:AT4G21300.1); similar to PPR986-12 [Physcomitrella patens] (GB:BAD67155.1); contains InterPro domain Pentatricopeptide repeat; (InterPro:IPR002885); contains InterPro domain Protein prenyltransferase; (InterPro:IPR008940); contains InterPro domain Tetratricopeptide-like helical; (InterPro:IPR011990),50.3,827,0,849,96.23971798Solyc06g049050.2.1,-1.658024274,4.586168091,0.028154435,"Expansin (AHRD V1 ***- O82625_SOLLC); contains Interpro domain(s)  IPR007112  Expansin 45, endoglucanase-like  IPR007117  Pollen allergen/expansin, C-terminal ",AT2G40610,ATEXP8,"member of Alpha-Expansin Gene Family. Naming convention from the Expansin Working Group (Kende et al, 2004. Plant Mol Bio).  Involved in the formation of nematode-induced syncytia in roots of Arabidopsis thaliana.",82.1,229,6.00E-86,313,91.53225806Solyc06g050270.1.1,1.799392604,3.144228059,0.015783256,CBL-interacting protein kinase 13 (AHRD V1 **** C4P7W2_VITVI); contains Interpro domain(s)  IPR002290  Serine/threonine protein kinase ,AT5G58380,CIPK10,Encodes a CBL-interacting protein kinase with similarity to SOS protein kinase.,55.73,454,5.00E-144,507,97.4595843Solyc06g050800.2.1,2.477758444,2.815620555,0.030274203,"Amino acid transporter (AHRD V1 **** B9HYI5_POPTR); contains Interpro domain(s)  IPR013057  Amino acid transporter, transmembrane ",AT3G56200,NA,"amino acid transporter family protein; similar to amino acid transporter family protein [Arabidopsis thaliana] (TAIR:AT2G40420.1); similar to Amino acid/polyamine transporter II [Medicago truncatula] (GB:ABE86055.1); contains InterPro domain Amino acid/polyamine transporter II; (InterPro:IPR002422); contains InterPro domain Amino acid transporter, transmembrane; (InterPro:IPR013057)",57.04,433,2.00E-118,422,97.26651481Solyc06g050990.2.1,2.051246106,3.139524172,0.011446752,"Multiple inositol polyphosphate phosphatase (AHRD V1 ***- Q54ND5_DICDI); contains Interpro domain(s)  IPR016274  Histidine acid phosphatase, eukaryotic ",AT1G09870,NA,histidine acid phosphatase family protein; similar to alkaline phytase isoform 2 [Lilium lon (GB:ABD96176.1); contains InterPro domain Histidine acid phosphatase; (InterPro:IPR000560),66.95,466,0,644,99.35622318Solyc06g051270.2.1,-1.311658374,5.865092649,0.022117754,GDP-D-mannose pyrophosphorylase 2,AT2G39770,CYT1,"Encodes a GDP-mannose pyrophosphorylase/ mannose-1-pyrophosphatase. This enzyme provides GDP-mannose, which is used for cell wall carbohydrate biosynthesis and protein glycosylation as well as for ascorbate (vitamin C) biosynthesis.",88.92,361,0,667,99.44751381Solyc06g051520.2.1,1.904915015,4.88138443,0.001889942,Mitochondrial import inner membrane translocase subunit TIM50 (AHRD V1 *--- TIM50_YEAST); contains Interpro domain(s)  IPR011948  Dullard-like phosphatase domain ,AT3G55960,NA,NLI interacting factor (NIF) family protein; similar to NLI interacting factor (NIF) family protein [Arabidopsis thaliana] (TAIR:AT1G29780.1); similar to hypothetical protein 56B23-g1 [Lycopersicon esculentum] (GB:AAW22871.1); similar to Os05g0466800 [Oryza sativa (japonica cultivar-group)] (GB:NP_001055788.1); similar to Os01g0833100 [Oryza sativa (japonica cultivar-group)] (GB:NP_001044710.1); contains InterPro domain Dullard-like phosphatase domain; (InterPro:IPR011948); contains InterPro domain NLI interacting factor; (InterPro:IPR004274),64.42,312,4.00E-105,377,97.71986971Solyc06g051920.2.1,1.947182406,4.761811958,0.00254403,Cyclic nucleotide gated channel (AHRD V1 **** A9CRE4_MALDO); contains Interpro domain(s)  IPR000595  Cyclic nucleotide-binding ,AT5G53130,ATCNGC1,member of Cyclic nucleotide gated channel family,66.34,716,0,845,99.53125Solyc06g053480.2.1,1.580799038,6.607988265,0.005424163,"Stearoyl-acyl carrier protein desaturase (AHRD V1 **** B7TZ44_SPIOL); contains Interpro domain(s)  IPR005067  Fatty acid desaturase, type 2 ",AT2G43710,FAB2,"Encodes a stearoyl-ACP desaturase, involved in fatty acid desaturation. The ssi2 mutants have increased 18:0 and reduced 18:1 fatty acids. Exogenous application of glycerol to wild type plants mimics the ssi2 mutant phenotype. The altered 18:1 fatty acid content in the ssi2 mutants has an impact on SA- and JA-mediated defense signaling.",83.58,402,0,692,99.49748744Solyc06g053920.2.1,1.236251793,5.354945921,0.036885367,Os11g0586300 protein (Fragment) (AHRD V1 ***- Q0IRY4_ORYSJ),AT3G55760,NA,similar to unknown protein [Arabidopsis thaliana] (TAIR:AT1G42430.1); similar to hypothetical protein [Trifolium pratense] (GB:BAE71279.1),55.19,578,9.00E-161,563,99.27797834Solyc06g054340.1.1,-1.697204262,3.144115146,0.031389921,Short-chain dehydrogenase/reductase SDR (AHRD V1 ***- A9B3A1_HERA2); contains Interpro domain(s)  IPR002347  Glucose/ribitol dehydrogenase ,AT5G19200,NA,short-chain dehydrogenase/reductase (SDR) family protein; similar to short-chain dehydrogenase/reductase (SDR) family protein [Arabidopsis thaliana] (TAIR:AT3G06060.1); similar to Short-chain dehydrogenase/reductase SDR [Medicago truncatula] (GB:ABE89395.1); similar to Os02g0701900 [Oryza sativa (japonica cultivar-group)] (GB:NP_001047846.1); contains InterPro domain Short-chain dehydrogenase/reductase SDR; (InterPro:IPR002198); contains InterPro domain Glucose/ribitol dehydrogenase; (InterPro:IPR002347),71.52,151,3.00E-59,224,78.53403141Solyc06g054540.2.1,-2.631682472,3.418645058,0.002160279,"CHY zinc finger family protein expressed (AHRD V1 ***- Q2QP88_ORYSJ); contains Interpro domain(s)  IPR008913  Zinc finger, CHY-type ",AT5G18650,NA,"zinc finger (C3HC4-type RING finger) family protein; similar to protein binding / zinc ion binding [Arabidopsis thaliana] (TAIR:AT3G62970.1); similar to Os12g0538500 [Oryza sativa (japonica cultivar-group)] (GB:NP_001066941.1); similar to CHY zinc finger family protein, expressed [Oryza sativa (japonica cultivar-group)] (GB:ABF93958.1); similar to Zinc finger, RING-type; Zinc finger, CHY-type [Medicago truncatula] (GB:ABE83637.1); contains InterPro domain Zinc finger, CHY-type; (InterPro:IPR008913); contains InterPro domain Zinc finger, RING-type; (InterPro:IPR001841)",83.9,267,3.00E-134,474,99.25373134Solyc06g059740.2.1,3.980466194,5.408372284,7.41E-10,"Alcohol dehydrogenase 2 (AHRD V1 **** Q84UY3_PETHY); contains Interpro domain(s)  IPR002085  Alcohol dehydrogenase superfamily, zinc-containing ",AT1G77120,ADH,Catalyzes the reduction of acetaldehyde using NADH as reductant. Requires zinc for activity. Dimer. Anaerobic response polypeptide (ANP). Fermentation. The protein undergoes thiolation following treatment with the oxidant tert-butylhydroperoxide.,79.63,383,8.00E-164,573,99.22077922Solyc06g060830.2.1,4.208831449,4.254453458,1.47E-07,"Homeobox-leucine zipper protein (AHRD V1 ***- Q40781_PIMBR); contains Interpro domain(s)  IPR006712  HD-ZIP protein, N-terminal ",AT4G16780,ATHB-2,"ATHB-2 (Homeobox-leucine zipper protein HAT4); DNA binding / transcription factor; Identical to Homeobox-leucine zipper protein HAT4 (Homeodomain-leucine zipper protein HAT4) (HD-ZIP protein 4) (Homeodomain transcription factor ATHB-2) (HD-ZIP protein ATHB-2) (HAT4) [Arabidopsis Thaliana] (GB:Q05466); similar to HAT2, transcription factor [Arabidopsis thaliana] (TAIR:AT5G47370.1); similar to hypothetical protein [Capsella rubella] (GB:CAB96199.1); contains InterPro domain Homeodomain-related; (InterPro:IPR012287); contains InterPro domain Homeobox; (InterPro:IPR001356); contains InterPro domain Leucine zipper, homeobox-associated; (InterPro:IPR003106); contains InterPro domain Homeodomain-like; (InterPro:IPR009057); contains InterPro domain Helix-turn-helix motif, lambda-like repressor; (InterPro:IPR000047); contains InterPro domain HD-ZIP protein, N-terminal; (InterPro:IPR006712)",54.61,293,6.00E-76,280,94.31438127Solyc06g060870.1.1,-2.208616383,3.706181051,0.039813813,"Lipase-like protein (AHRD V1 ***- Q949E1_ORYSA); contains Interpro domain(s)  IPR002921  Lipase, class 3 ",AT4G16820,PLA-I{beta]2,"lipase class 3 family protein; similar to DAD1 (DEFECTIVE ANTHER DEHISCENCE 1), triacylglycerol lipase [Arabidopsis thaliana] (TAIR:AT2G44810.1); similar to lipase-like protein [Oryza sativa] (GB:CAC39051.1); similar to Os02g0653900 [Oryza sativa (japonica cultivar-group)] (GB:NP_001047607.1); contains InterPro domain Lipase, class 3; (InterPro:IPR002921)",59.47,528,2.00E-161,565,98.84393064Solyc06g062430.2.1,-2.221509823,3.394296039,0.01061236,Inositol oxygenase (AHRD V1 **** A5FF81_FLAJ1); contains Interpro domain(s)  IPR007828  Protein of unknown function DUF706 ,AT1G14520,MIOX1,Encodes MIOX1.  Belongs to  myo-inositol oxygenase gene family.,74.11,309,9.00E-129,456,99.34640523Solyc06g062990.1.1,1.245979244,5.094171464,0.037441086,Exocyst complex protein exo70 (AHRD V1 **-- EXO70_ASPFU); contains Interpro domain(s)  IPR004140  Exo70 exocyst complex subunit ,AT1G72470,ATEXO70D1,"A member of EXO70 gene family, putative exocyst subunits, conserved in land plants. Arabidopsis thaliana contains 23 putative EXO70 genes, which can be classified into eight clusters on the phylogenetic tree.",68.55,620,0,814,98.49246231Solyc06g065690.2.1,1.911331357,5.40016267,0.001352301,"Serine/threonine-protein phosphatase 2A regulatory subunit delta 1 isoform (AHRD V1 ***- Q0CAR1_ASPTN); contains Interpro domain(s)  IPR002554  Protein phosphatase 2A, regulatory B subunit, B56 ",AT5G25510,NA,"serine/threonine protein phosphatase 2A (PP2A) regulatory subunit B', putative; Identical to Serine/threonine protein phosphatase 2A 57 kDa regulatory subunit B' iota isoform (PP2A, B' subunit, iota isoform) (AtB' iota) (B'IOTA) [Arabidopsis Thaliana] (GB:Q93YV6); similar to serine/threonine protein phosphatase 2A (PP2A) regulatory subunit B' (B'gamma) [Arabidopsis thaliana] (TAIR:AT4G15415.1); similar to protein phosphatase 2A B'kappa subunit [Oryza sativa (japonica cultivar-group)] (GB:CAC85920.1); contains InterPro domain Protein phosphatase 2A, regulatory B subunit, B56; (InterPro:IPR002554)",72.17,460,0,711,91.98396794Solyc06g068080.2.1,-1.138119915,5.774866825,0.045914067,Zeta2-COP (AHRD V1 **-- A8JHN4_CHLRE); contains Interpro domain(s)  IPR011012  Longin-like ,AT1G15370,NA,similar to Lon (GB:ABD28727.1); contains InterPro domain Longin-like; (InterPro:IPR011012),84.25,146,4.00E-72,266,97.97297297Solyc06g068090.2.1,-1.345784039,6.228028545,0.036509525,"Phospholipase D (AHRD V1 **** D2E4A5_9ROSI); contains Interpro domain(s)  IPR011402  Phospholipase D, plant ",AT3G15730,PLD,Encodes phospholipase D alpha 1. Positive regulator of abscisic acid (ABA) mediated stomatal movements.,78.02,810,0,1345,99.75308642Solyc06g068210.1.1,2.832160801,5.538918998,3.93E-06,"Protein FAR1-RELATED SEQUENCE 8 (AHRD V1 ***- FRS8_ARATH); contains Interpro domain(s)  IPR004330  Transcription factor, FAR1-related ",AT1G80010,FRS8,"FRS8 (FAR1-related sequence 8); zinc ion binding; similar to FRS6 (FAR1-related sequence 6), zinc ion binding [Arabidopsis thaliana] (TAIR:AT1G52520.1); similar to Heavy metal transport/detoxification protein [Medicago truncatula] (GB:ABE93744.1); contains InterPro domain Zinc finger, PMZ-type; (InterPro:IPR006564); contains InterPro domain Zinc finger, SWIM-type; (InterPro:IPR007527); contains InterPro domain FAR1; (InterPro:IPR004330)",54.72,636,0,706,83.58008075Solyc06g068400.2.1,1.372602807,4.867478637,0.028212121,"60S ribosomal protein L7-like protein (AHRD V1 ***- B3TM16_ELAGV); contains Interpro domain(s)  IPR005998  Ribosomal protein L7, eukaryotic ",AT2G01250,NA,"60S ribosomal protein L7 (RPL7B); Identical to 60S ribosomal protein L7-2 (RPL7B) [Arabidopsis Thaliana] (GB:P60040;GB:O80581;GB:Q42208;GB:Q9ZU42); similar to 60S ribosomal protein L7 (RPL7D) [Arabidopsis thaliana] (TAIR:AT3G13580.1); similar to 60S ribosomal protein L7 (RPL7C) [Arabidopsis thaliana] (TAIR:AT2G44120.2); similar to ribosomal protein L7 (GB:1909359B); contains InterPro domain Ribosomal L30, N-terminal; (InterPro:IPR012988); contains InterPro domain Ribosomal protein L30; (InterPro:IPR000517); contains InterPro domain Ribosomal protein L7, eukaryotic form; (InterPro:IPR005998)",50.85,236,1.00E-66,249,94.73684211Solyc06g068650.2.1,-2.888958302,3.385677459,0.024488161,4-coumarate CoA ligase (AHRD V1 **** Q0GZS1_9BORA); contains Interpro domain(s)  IPR000873  AMP-dependent synthetase and ligase ,AT3G21240,4CL2,"encodes an isoform of 4-coumarate:CoA ligase (4CL), which is involved in the last step of the general phenylpropanoid pathway. The catalytic efficiency was in the following (descending) order:  p-coumaric acid, caffeic acid, ferulic acid, 5-OH-ferulic acid and cinnamic acid. At4CL2 was unable to use sinapic acid as substrate.",71.58,549,0,803,99.44852941Solyc06g069310.2.1,1.226839903,5.441228507,0.037282159,Nuclear transcription factor Y subunit B-6 (AHRD V1 **-* B6UH02_MAIZE); contains Interpro domain(s)  IPR003958  Transcription factor CBF/NF-Y/archaeal histone ,AT5G23090,NF-YB13,"TATA-binding protein-associated phosphoprotein Dr1 protein, putative (DR1); Identical to Dr1 protein homolog (DR1) [Arabidopsis Thaliana] (GB:P49592); similar to TATA-binding protein-associated phosphoprotein Dr1 protein, putative [Arabidopsis thaliana] (TAIR:AT5G08190.1); similar to repressor protein [Glycine max] (GB:AAL73489.1); contains InterPro domain Histone-fold; (InterPro:IPR009072); contains InterPro domain Transcription factor CBF/NF-Y/archaeal histone; (InterPro:IPR003958); contains InterPro domain Histone-fold/TFIID-TAF/NF-Y; (InterPro:IPR007124)",86.32,117,1.00E-56,214,87.87878788Solyc06g069730.2.1,-1.930272235,6.271258269,0.002068328,"Chlorophyll a-b binding protein 4, chloroplastic (AHRD V1 ***- CA4_ARATH); contains Interpro domain(s)  IPR001344  Chlorophyll A-B binding protein ",AT3G47470,CAB4,Encodes a chlorophyll a/b-binding protein that is more similar to the PSI Cab proteins than the PSII cab proteins. The predicted protein is about 20 amino acids shorter than most known Cab proteins.,84.46,251,6.00E-125,443,98.80478088Solyc06g069890.2.1,1.187633095,7.649106048,0.030848572,Nucleosome assembly protein family (AHRD V1 **-- A9RDJ7_PHYPA); contains Interpro domain(s)  IPR002164  Nucleosome assembly protein (NAP) ,AT1G18800,NRP2,Double nrp1-1 nrp2-1 mutants show arrest of cell cycle progression at G2/M  and disordered cellular organization occurred in root tips. Localize in the nucleus and can form homomeric and heteromeric protein complexes with NRP1. Bind histones Histone2A and Histone2B and associate with chromatin in vivo.,73.13,227,2.00E-86,315,85.11450382Solyc06g071160.2.1,1.338354993,5.239229947,0.028580327,"Beta-1 3-galactosyltransferase-like protein (AHRD V1 ***- D8RWA4_SELML); contains Interpro domain(s)  IPR002659  Glycosyl transferase, family 31 ",AT5G62620,NA,"galactosyltransferase family protein; similar to galactosyltransferase family protein [Arabidopsis thaliana] (TAIR:AT4G21060.1); similar to galactosyltransferase family protein [Arabidopsis thaliana] (TAIR:AT1G74800.1); similar to galactosyltransferase family protein [Arabidopsis thaliana] (TAIR:AT1G27120.1); similar to galactosyltransferase family-like protein [Oryza sativa (japonica cultivar-group)] (GB:BAC83183.1); similar to galactosyltransferase family protein, putative, expressed [Oryza sativa (japonica cultivar-group)] (GB:ABF99414.1); similar to Glycosyl transferase, family 31; Ar (GB:ABE93312.1); contains InterPro domain Concanavalin A-like lectin/glucanase, subgroup; (InterPro:IPR013320); contains InterPro domain Galectin, galactose-binding lectin; (InterPro:IPR001079); contains InterPro domain Concanavalin A-like lectin/glucanase; (InterPro:IPR008985); contains InterPro domain L-Aspartase-like; (InterPro:IPR008948); contains InterPro domain Glycosyl transferase, family 31; (InterPro:IPR002659)",65.82,673,0,879,99.10044978Solyc06g071820.2.1,-1.197712848,3.740279361,0.040473432,"Speckle-type poz protein (AHRD V1 *--- Q179U2_AEDAE); contains Interpro domain(s)  IPR000197  Zinc finger, TAZ-type ",AT3G48360,ATBT2,encodes a protein (BT2) that is an essential component of the TAC1-mediated telomerase activation pathway,60,345,6.00E-112,400,94Solyc06g071850.2.1,1.846786578,4.419402433,0.004629581,TPR repeat (AHRD V1 ***- Q469C8_METBF); contains Interpro domain(s)  IPR011990  Tetratricopeptide-like helical ,AT5G63200,NA,"tetratricopeptide repeat (TPR)-containing protein; similar to SEC (SECRET AGENT), transferase, transferring glycosyl groups [Arabidopsis thaliana] (TAIR:AT3G04240.1); similar to P0497A05.3 [Oryza sativa (japonica cultivar-group)] (GB:BAB92560.1); similar to Os01g0906600 [Oryza sativa (japonica cultivar-group)] (GB:NP_001045134.1); contains InterPro domain Tetratricopeptide region; (InterPro:IPR013026); contains InterPro domain Tetratricopeptide TPR_1; (InterPro:IPR001440); contains InterPro domain Tetratricopeptide TPR_2; (InterPro:IPR013105); contains InterPro domain Tetratricopeptide-like helical; (InterPro:IPR011990)",61.21,647,0,726,97.72036474Solyc06g072310.2.1,1.232026654,6.140293942,0.030589592,Homeobox-leucine zipper protein PROTODERMAL FACTOR 2 (AHRD V1 **** PDF2_ARATH); contains Interpro domain(s)  IPR002913  Lipid-binding START ,AT1G73360,ATHDG11,"homeobox-leucine zipper family protein / lipid-binding START domain-containing protein; similar to HDG12 (HOMEODOMAIN GLABROUS12), transcription factor [Arabidopsis thaliana] (TAIR:AT1G17920.1); similar to PDF2 (PROTODERMAL FACTOR2), DNA binding / transcription factor [Arabidopsis thaliana] (TAIR:AT4G04890.1); similar to ATML1 (MERISTEM LAYER 1), DNA binding [Arabidopsis thaliana] (TAIR:AT4G21750.2); similar to baby boom interacting protein 1A [Brassica napus] (GB:ABA54874.1); similar to baby boom interacting protein 1B [Brassica napus] (GB:ABA70759.1); similar to homeodomain protein HOX3 [Gossypium hirsutum] (GB:AAU12247.1); contains InterPro domain Homeodomain-related; (InterPro:IPR012287); contains InterPro domain Homeobox; (InterPro:IPR001356); contains InterPro domain Lipid-binding START; (InterPro:IPR002913); contains InterPro domain Homeodomain-like; (InterPro:IPR009057); contains InterPro domain Helix-turn-helix motif, lambda-like repressor; (InterPro:IPR000047)",62.54,702,0,830,96.23955432Solyc06g072360.2.1,1.336410574,4.141108787,0.049937843,"Zinc finger protein (AHRD V1 *-*- Q764N7_MALDO); contains Interpro domain(s)  IPR007087  Zinc finger, C2H2-type ",AT1G68130,AtIDD14,"ATIDD14 (ARABIDOPSIS THALIANA INDETERMINATE(ID)-DOMAIN 14); nucleic acid binding / transcription factor/ zinc ion binding; similar to ATIDD16 (ARABIDOPSIS THALIANA INDETERMINATE(ID)-DOMAIN 16), nucleic acid binding / transcription factor/ zinc ion binding [Arabidopsis thaliana] (TAIR:AT1G25250.1); similar to Os09g0449400 [Oryza sativa (japonica cultivar-group)] (GB:NP_001063321.1); similar to putative zinc finger protein ID1 [Oryza sativa (japonica cultivar-group)] (GB:BAD37964.1); contains InterPro domain Zinc finger, C2H2-type; (InterPro:IPR007087)",55.52,362,3.00E-97,352,89.3129771Solyc06g072610.2.1,3.623966352,5.835439489,7.92E-09,"Palmitoyltransferase-like protein (AHRD V1 *-** C6YXK4_ORYSJ); contains Interpro domain(s)  IPR001594  Zinc finger, DHHC-type ",AT3G26935,NA,"zinc finger (DHHC type) family protein; similar to zinc finger (DHHC type) family protein [Arabidopsis thaliana] (TAIR:AT5G41060.1); similar to Os09g0508300 [Oryza sativa (japonica cultivar-group)] (GB:NP_001063622.1); similar to Os08g0535400 [Oryza sativa (japonica cultivar-group)] (GB:NP_001062355.1); similar to P0482D04.5 [Oryza sativa (japonica cultivar-group)] (GB:BAB89658.1); contains InterPro domain Zinc finger, DHHC-type; (InterPro:IPR001594)",64.12,432,6.00E-151,530,96.3800905Solyc06g073270.2.1,-1.1210647,5.29041173,0.044229552,"Golgi apparatus membrane protein tvp23 (AHRD V1 **-- C5JI99_AJEDS); contains Interpro domain(s)  IPR008564  Protein of unknown function DUF846, eukaryotic ",AT1G09330,NA,"Identical to FAM18-like protein At1g09330 [Arabidopsis Thaliana] (GB:Q8LEK2;GB:Q9ZPZ2); similar to Os01g0331900 [Oryza sativa (japonica cultivar-group)] (GB:NP_001042930.1); similar to Os05g0159100 [Oryza sativa (japonica cultivar-group)] (GB:NP_001054714.1); similar to FAM18-like protein CG5021 (GB:Q8IQC1); contains InterPro domain Protein of unknown function DUF846, eukaryotic; (InterPro:IPR008564)",81.71,175,5.00E-82,300,94.56521739