ITAG,logFC,logCPM,PValue,SGN_annotation,AGI,symbol,gene_name,X..identity,alignment.length,e.value,bit.score,percent.query.alignSolyc02g091500.1.1,2.349788188,4.392201523,0.000300558,Calmodulin (AHRD V1 ***- B6TGU5_MAIZE); contains Interpro domain(s)  IPR011992  EF-Hand type ,AT5G37770,CML24,"Encodes a protein with 40% similarity to calmodulin. Binds Ca(2+) and, as a consequence, undergoes conformational changes. CML24 expression occurs in all major organs, and transcript levels are increased from 2- to 15-fold in  plants subjected to touch, darkness, heat,  cold, hydrogen peroxide, abscisic acid  (ABA), and indole-3-acetic acid. However, CML24 protein accumulation changes were not  detectable. The putative CML24 regulatory region confers reporter expression at sites  of predicted mechanical stress; in regions undergoing growth; in vascular tissues and  various floral organs; and in stomata, trichomes, and hydathodes. CML24-underexpressing transgenics are resistant to ABA inhibition of germination and seedling growth, are defective in long-day induction of flowering, and have enhanced tolerance to CoCl(2), molybdic acid, ZnSO(4), and MgCl(2).",55.84,154,4.00E-42,167,92.99363057Solyc02g092660.2.1,2.024074778,3.951526224,0.005566294,Major facilitator superfamily domain-containing protein (AHRD V1 ***- C9SAV7_VERA1); contains Interpro domain(s)  IPR008509  Protein of unknown function DUF791 ,AT2G23093,NA,similar to unknown protein [Arabidopsis thaliana] (TAIR:AT3G49310.1); similar to Protein of unknown function DUF791 [Medicago truncatula] (GB:ABE85757.1); contains InterPro domain Protein of unknown function DUF791; (InterPro:IPR008509),54.79,449,5.00E-140,494,99.55357143Solyc02g093390.2.1,1.354850791,3.780400409,0.048886442,Ribosomal RNA-processing protein (AHRD V1 ***- B6K4Z8_SCHJY); contains Interpro domain(s)  IPR007823  Methyltransferase-related ,AT5G40530,NA,"similar to Protein of unknown function DUF691, methyltransferases-related [Medicago truncatula] (GB:ABE86909.1); contains InterPro domain Methyltransferases-related; (InterPro:IPR007823)",69.83,242,2.00E-101,365,87.31884058Solyc02g093490.2.1,-1.117173563,5.055374353,0.046569298,SAGA-associated factor 29 homolog (AHRD V1 ***- B5XG72_SALSA); contains Interpro domain(s)  IPR010750  Protein of unknown function DUF1325 ,AT3G27460,NA,similar to unknown protein [Arabidopsis thaliana] (TAIR:AT5G40550.1); similar to expressed protein [Oryza sativa (japonica cultivar-group)] (GB:ABA97166.2); similar to Os12g0290600 [Oryza sativa (japonica cultivar-group)] (GB:NP_001066601.1); contains InterPro domain Protein of unknown function DUF1325; (InterPro:IPR010750),73.51,268,3.00E-103,371,98.88475836Solyc02g093550.2.1,1.594909375,4.672512209,0.012936098,Methyltransferase type 11 (AHRD V1 ***- C7QSM0_CYAP0); contains Interpro domain(s)  IPR013216  Methyltransferase type 11 ,AT3G01660,NA,similar to unknown protein [Arabidopsis thaliana] (TAIR:AT4G29590.1); similar to unnamed protein product [Ostreococcus tauri] (GB:CAL51842.1); similar to Os04g0481300 [Oryza sativa (japonica cultivar-group)] (GB:NP_001053109.1); contains InterPro domain Methyltransferase type 11; (InterPro:IPR013216); contains InterPro domain Generic methyltransferase; (InterPro:IPR001601),68.75,240,3.00E-97,351,83.27526132Solyc02g093770.2.1,1.31681238,6.065439302,0.020548804,GPI inositol-deacylase (AHRD V1 *-*- C5FP83_NANOT); contains Interpro domain(s)  IPR012908  PGAP1-like ,AT3G27325,NA,similar to hypothetical protein [Neurospora crassa OR74A] (GB:XP_962691.1); similar to Os09g0266400 [Oryza sativa (japonica cultivar-group)] (GB:NP_001062719.1); similar to hypothetical protein DDBDRAFT_0218240 [Dictyostelium discoideum AX4] (GB:XP_641187.1); contains InterPro domain PGAP1-like; (InterPro:IPR012908),60.63,1087,0,1272,96.50537634Solyc02g094190.2.1,-2.543598079,3.294649479,0.015770031,Nodulin family protein (AHRD V1 ***- D7M603_ARALY); contains Interpro domain(s)  IPR010658  Nodulin-like ,AT3G01930,NA,nodulin family protein; similar to nodulin family protein [Arabidopsis thaliana] (TAIR:AT5G14120.1); similar to nodulin-like protein [Poncirus trifoliata] (GB:AAN62343.1); similar to Os08g0532400 [Oryza sativa (japonica cultivar-group)] (GB:NP_001062339.1); similar to Os04g0388700 [Oryza sativa (japonica cultivar-group)] (GB:NP_001052632.1); contains InterPro domain Nodulin-like; (InterPro:IPR010658),73.82,592,0,819,98.98477157Solyc02g094350.2.1,-1.85101434,3.601626806,0.021040052,"Membrane-anchored ubiquitin-fold protein 2 (AHRD V1 ***- D7M7C8_ARALY); contains Interpro domain(s)  IPR017000  Membrane-anchored ubiquitin-fold protein, HCG-1 ",AT3G26980,MUB4,ubiquitin family protein; Identical to Membrane-anchored ubiquitin-fold protein 4 precursor (Membrane- anchored ub-fold protein 4) (AtMUB4) (MUB4) [Arabidopsis Thaliana] (GB:Q9LSD8); similar to ATGP4 (Arabidopsis thaliana geranylgeranylated protein) [Arabidopsis thaliana] (TAIR:AT4G24990.1); similar to NTGP5 [Nicotiana tabacum] (GB:AAD00119.1); similar to Os02g0750600 [Oryza sativa (japonica cultivar-group)] (GB:NP_001048133.1); similar to Os04g0393300 [Oryza sativa (japonica cultivar-group)] (GB:NP_001052648.1); contains InterPro domain Ubiquitin; (InterPro:IPR000626),65.83,120,8.00E-45,174,98.31932773Solyc03g005320.2.1,1.269369812,4.964776294,0.036038111,Fatty acid elongase 3-ketoacyl-CoA synthase (AHRD V1 **** Q6DUV5_BRANA); contains Interpro domain(s)  IPR012392  Very-long-chain 3-ketoacyl-CoA synthase ,AT2G26640,KCS11,"beta-ketoacyl-CoA synthase, putative; Identical to 3-ketoacyl-CoA synthase 11 (EC 2.3.1.-) (EC 2.3.1.119) (KCS-11) (Very- long-chain fatty acid condensing enzyme 11) (VLCFA condensing enzyme 11) (KCS11) [Arabidopsis Thaliana] (GB:O48780); similar to beta-ketoacyl-CoA synthase, putative [Arabidopsis thaliana] (TAIR:AT5G43760.1); similar to beta-ketoacyl-CoA synthase, putative [Arabidopsis thaliana] (TAIR:AT1G04220.1); similar to very-long-chain fatty acid condensing enzyme, putative [Arabidopsis thaliana] (TAIR:AT1G19440.1); similar to fatty acid elongase 1-like protein [Limnanthes douglasii] (GB:AAG28600.1); similar to beta-ketoacyl-CoA-synthase [Marchantia polymorpha] (GB:AAO48425.1); similar to putative fatty acid elongase [Zea mays] (GB:CAC01441.1); contains InterPro domain FAE1/Type III polyketide synthase-like protein; (InterPro:IPR013601); contains InterPro domain Very-long-chain 3-ketoacyl-CoA synthase; (InterPro:IPR012392); contains InterPro domain Chalcone and stilbene synthases, C-terminal; (InterPro:IPR012328)",76.32,494,0,819,94.80769231Solyc03g006360.2.1,-1.656217354,4.07389328,0.006645691,Auxin-repressed protein (AHRD V1 ***- Q6PXE1_9SOLN); contains Interpro domain(s)  IPR008406  Dormancyauxin associated ,AT1G28330,DRM1,dormancy-associated protein (DRM1),55.38,130,1.00E-30,128,98.47328244Solyc03g006660.2.1,2.683907161,4.548966709,5.18E-05,Uncharacterized aarF domain-containing protein kinase 2 (AHRD V1 *--* ADCK2_HUMAN); contains Interpro domain(s)  IPR004147  ABC-1 ,AT1G11390,NA,ABC1 family protein; similar to ABC1 family protein [Arabidopsis thaliana] (TAIR:AT1G61640.1); similar to H0112G12.2 [Oryza sativa (indica cultivar-group)] (GB:CAH67057.1); similar to putative 62.8 kDa protein [Oryza sativa (japonica cultivar-group)] (GB:AAL87193.1); similar to Protein kinase-like [Medicago truncatula] (GB:ABD32343.1); contains InterPro domain Protein kinase-like; (InterPro:IPR011009); contains InterPro domain ABC-1; (InterPro:IPR004147),66.44,578,0,797,90.96671949Solyc03g006900.1.1,-2.408089326,5.542789473,0.000825855,Crinkler (CRN) family protein (AHRD V1 *-*- D0NJ10_PHYIN); contains Interpro domain(s)  IPR011009  Protein kinase-like ,AT5G51800,NA,similar to gt-2-related [Arabidopsis thaliana] (TAIR:AT2G33550.1); similar to CRN-like CRN8 [Phytophthora infestans] (GB:AAY43402.1); contains InterPro domain Protein kinase-like; (InterPro:IPR011009),51.44,935,0,856,91.10429448Solyc03g006980.2.1,-2.112663379,4.331174363,0.005205282,"Alpha-L-fucosidase 1 (AHRD V1 **** B6U1Y8_MAIZE); contains Interpro domain(s)  IPR000933  Glycoside hydrolase, family 29 ",AT2G28100,ATFUC1,"Encodes a protein with &#945;-fucosidase activity. The activity was assessed on 2'-fucosyl-lactitol. AtFUC1 was not able to act on XXFG substrates, at least when heterologously expressed in <i>Pichia pastoris</i>. The enzyme has been postulated to act on fucosylated substrates other than xyloglucan oligosaccharides.  was shown (<i>Pichia pastoris</i>) to hydrolyze fucose in 3- and 4-linkage , hence was characterized as alpha-L-3,4-fucosidase",52.69,446,9.00E-138,487,90.32921811Solyc03g007010.2.1,1.509142613,4.285362249,0.015982436,"ATP-dependent DEAD-box RNA helicase DeaD (AHRD V1 *-** D5SAR5_9MICC); contains Interpro domain(s)  IPR011545  DNA/RNA helicase, DEAD/DEAH box type, N-terminal ",AT5G62190,PRH75,DEAD/DEAH box RNA helicase PRH75,70.84,535,0,734,77.89165447Solyc03g007260.2.1,-1.636770123,3.229045232,0.028323324,Cyclic nucleotide-gated ion channel 1 (AHRD V1 **** B6U0R1_MAIZE); contains Interpro domain(s)  IPR005821  Ion transport ,AT5G53130,ATCNGC1,member of Cyclic nucleotide gated channel family,69.8,404,8.00E-165,576,97.53694581Solyc03g007520.2.1,1.443052487,5.672153501,0.013975444,"Proline-rich cell wall protein-like (AHRD V1 ***- Q8LG11_ARATH); contains Interpro domain(s)  IPR015940  Ubiquitin-associated/translation elongation factor EF1B, N-terminal, eukaryote ",AT5G53330,NA,similar to Os06g0160400 [Oryza sativa (japonica cultivar-group)] (GB:NP_001056879.1); contains InterPro domain UBA-like; (InterPro:IPR009060); contains InterPro domain Ubiquitin-associated; (InterPro:IPR000449),52.61,230,4.00E-45,177,99.06976744Solyc03g007840.1.1,1.674978318,3.180058378,0.02181924,Pentatricopeptide repeat-containing protein (AHRD V1 ***- D7MBT1_ARALY); contains Interpro domain(s)  IPR002885  Pentatricopeptide repeat ,AT3G49142,NA,NA,64.74,641,0,863,93.65781711Solyc03g013620.1.1,1.402450724,6.378599876,0.014474069,"NADH-quinone oxidoreductase subunit L (AHRD V1 ***- NUOL_RHOCA); contains Interpro domain(s)  IPR018393  NADH-plastoquinone oxidoreductase, chain 5 subgroup ",ATCG01010,NDHF,Chloroplast encoded  NADH dehydrogenase unit.,75.33,150,1.00E-61,231,92.54658385Solyc03g025190.2.1,1.219666229,4.94103368,0.040412913,Multidrug resistance protein mdtK (AHRD V1 **-- MDTK_YERP3); contains Interpro domain(s)  IPR002528  Multi antimicrobial extrusion protein MatE ,AT4G25640,ATDTX35,MATE efflux family protein; similar to MATE efflux family protein [Arabidopsis thaliana] (TAIR:AT4G00350.1); similar to Multi antimicrobial extrusion protein MatE [Medicago truncatula] (GB:ABE85324.1); similar to putative anthocyanin permease [Lycopersicon esculentum] (GB:AAQ55183.1); contains InterPro domain Multi antimicrobial extrusion protein MatE; (InterPro:IPR002528),72.19,471,0,652,92.70216963Solyc03g025290.2.1,3.475333884,4.21170766,1.11E-06,Hydroxyproline-rich glycoprotein family protein (AHRD V1 ***- D7MRR7_ARALY),AT4G25620,NA,hydroxyproline-rich glycoprotein family protein; similar to hydroxyproline-rich glycoprotein family protein [Arabidopsis thaliana] (TAIR:AT5G52430.1); similar to Os02g0822000 [Oryza sativa (japonica cultivar-group)] (GB:NP_001048555.1); similar to unknown [Thellun (GB:ABJ98061.1),57.14,490,7.00E-100,361,99.1507431Solyc03g025390.2.1,1.26454129,5.272559117,0.038042916,Retinol dehydrogenase 12 (AHRD V1 **** B6TAL8_MAIZE); contains Interpro domain(s)  IPR002347  Glucose/ribitol dehydrogenase ,AT4G23420,NA,short-chain dehydrogenase/reductase (SDR) family protein; similar to short-chain dehydrogenase/reductase (SDR) family protein [Arabidopsis thaliana] (TAIR:AT4G23430.2); similar to short-chain dehydrogenase Tic32 [Pisum sativum] (GB:AAS38575.1); contains InterPro domain Short-chain dehydrogenase/reductase SDR; (InterPro:IPR002198); contains InterPro domain Glucose/ribitol dehydrogenase; (InterPro:IPR002347),66.99,312,2.00E-113,405,98.72611465Solyc03g026290.2.1,-1.343121459,5.192863863,0.024869267,Post-GPI attachment to proteins factor 3 (AHRD V1 **-- PGAP3_XENTR); contains Interpro domain(s)  IPR007217  Per1-like ,AT1G16560,NA,Per1-like family protein; similar to Per1-like protein-related [Arabidopsis thaliana] (TAIR:AT5G62130.1); similar to Per1-like family protein [Solanum tuberosum] (GB:ABB72805.1); contains InterPro domain Per1-like; (InterPro:IPR007217),68.99,316,1.00E-134,476,91.83673469Solyc03g026350.2.1,2.940422424,5.883388497,1.06E-06,"WD-40 repeat family protein (AHRD V1 **-- D7MJ15_ARALY); contains Interpro domain(s)  IPR020472  G-protein beta WD-40 repeat, region ",AT4G25440,ZFWD1,"ZFWD1 (zinc finger WD40 repeat protein 1); nucleic acid binding / zinc ion binding; similar to WD-40 repeat family protein / zfwd2 protein (ZFWD2), putative [Arabidopsis thaliana] (TAIR:AT5G51980.1); similar to Os02g0677700 [Oryza sativa (japonica cultivar-group)] (GB:NP_001047729.1); similar to Os03g0145600 [Oryza sativa (japonica cultivar-group)] (GB:NP_001048950.1); similar to hypothetical protein DDBDRAFT_0187121 [Dictyostelium discoideum AX4] (GB:XP_637649.1); contains InterPro domain WD-40 repeat; (InterPro:IPR001680); contains InterPro domain Zinc finger, CCCH-type; (InterPro:IPR000571)",64.6,435,1.00E-158,556,98.84259259Solyc03g031970.2.1,1.168582466,8.63046867,0.032285427,Auxin response factor 8-1 (AHRD V1 **** E0A8P3_SOLLC); contains Interpro domain(s)  IPR010525  Auxin response factor ,AT5G37020,ARF8,Encodes a member of the auxin response factor family. Mediates auxin response via expression of auxin regulated genes. Acts redundantly with ARF6 to control stamen elongation and flower maturation. Expression of ARF8 is controlled by miR167.,66.79,825,0,1016,95.97633136Solyc03g032010.2.1,-1.486557027,4.358216137,0.013458429,"Hydroxy-methylglutaryl-coenzyme A reductase (AHRD V1 **** O48624_TOBAC); contains Interpro domain(s)  IPR002202  Hydroxymethylglutaryl-CoA reductase, class I/II, catalytic ",AT1G76490,HMG1,"Encodes a 3-hydroxy-3-methylglutaryl coenzyme A reductase, which is involved in melavonate biosynthesis and performs the first committed step in isoprenoid biosynthesis. Expression is activated in dark in leaf tissue but not controlled by light in the root (confine",69.41,510,0,684,98.6083499Solyc03g032020.2.1,-1.447587835,4.413816065,0.026791946,"Hydroxy-methylglutaryl-coenzyme A reductase (AHRD V1 **** O48624_TOBAC); contains Interpro domain(s)  IPR002202  Hydroxymethylglutaryl-CoA reductase, class I/II, catalytic ",AT1G76490,HMG1,"Encodes a 3-hydroxy-3-methylglutaryl coenzyme A reductase, which is involved in melavonate biosynthesis and performs the first committed step in isoprenoid biosynthesis. Expression is activated in dark in leaf tissue but not controlled by light in the root (confine",69.47,511,0,687,89.54954955Solyc03g032120.2.1,1.782556482,3.597199732,0.021270045,Nucleoside-triphosphatase THEP1 (AHRD V1 ***- NTPTH_THEMA); contains Interpro domain(s)  IPR004948  Protein of unknown function DUF265 ,AT5G66005,NA,similar to Unknown protein [Oryza sativa (japonica cultivar-group)] (GB:AAM22714.1); similar to Os03g0130700 [Oryza sativa (japonica cultivar-group)] (GB:NP_001048856.1); contains InterPro domain Protein of unknown function DUF265; (InterPro:IPR004948),64.92,191,8.00E-73,269,98.44559585Solyc03g032190.2.1,1.721650781,6.485447816,0.002584266,"Cyclin B2 (AHRD V1 **** Q9XGI1_SOLLC); contains Interpro domain(s)  IPR014400  Cyclin, A/B/D/E ",AT1G20610,CYCB2;3,"CYCB2;3 (CYCLIN B2;3); cyclin-dependent protein kinase regulator; similar to CYCB2,4 (CYCLIN B2,4), cyclin-dependent protein kinase regulator [Arabidopsis thaliana] (TAIR:AT1G76310.1); similar to G2/mitotic-specific cyclin-1 (B-like cyclin) (CycMs1) (GB:P46277); contains InterPro domain Cyclin, N-terminal; (InterPro:IPR006671); contains InterPro domain Cyclin-like; (InterPro:IPR011028); contains InterPro domain Cyclin-related; (InterPro:IPR013763); contains InterPro domain Cyclin, C-terminal; (InterPro:IPR004367); contains InterPro domain Cyclin; (InterPro:IPR006670)",60.05,418,5.00E-138,487,95.13888889Solyc03g033320.2.1,-1.267586418,3.806862282,0.045173297,"Prolyl 4-hydroxylase alpha subunit-like protein (AHRD V1 ***- Q9FKX6_ARATH); contains Interpro domain(s)  IPR006620  Prolyl 4-hydroxylase, alpha subunit ",AT5G66060,NA,"oxidoreductase, 2OG-Fe(II) oxygenase family protein; similar to oxidoreductase, 2OG-Fe(II) oxygenase family protein [Arabidopsis thaliana] (TAIR:AT2G17720.1); similar to 2OG-Fe(II) oxygenase [Medicago truncatula] (GB:ABE81866.1); contains InterPro domain Prolyl 4-hydroxylase, alpha subunit; (InterPro:IPR006620); contains InterPro domain 2OG-Fe(II) oxygenase; (InterPro:IPR005123)",74.81,266,1.00E-118,422,97.06959707Solyc03g034090.2.1,2.28893116,4.497607721,0.000399674,BAC19.4 (AHRD V1 ***- Q9FYX2_SOLLC); contains Interpro domain(s)  IPR010608  Protein of unknown function DUF1195 ,AT5G65650,NA,similar to unknown protein [Arabidopsis thaliana] (TAIR:AT4G36660.1); similar to BAC19.4 [Lycopersicon esculentum] (GB:AAG01119.1); contains InterPro domain Protein of unknown function DUF1195; (InterPro:IPR010608),59.88,167,2.00E-43,171,90.71038251Solyc03g034180.2.1,-1.178478813,5.494787872,0.037615007,14-3-3 protein beta/alpha-1 (AHRD V1 **-- 143B1_DANRE); contains Interpro domain(s)  IPR000308  14-3-3 protein ,AT5G38480,GRF3,"general regulatory factor, a 14-3-3 gene",88.93,253,1.00E-130,462,96.91119691Solyc03g034270.2.1,-1.896487301,3.812958604,0.019989819,Abhydrolase domain-containing protein FAM108B1 (AHRD V1 **-- C0HAS5_SALSA),AT5G38220,NA,similar to unknown protein [Arabidopsis thaliana] (TAIR:AT1G66900.1); similar to Os01g0689800 [Oryza sativa (japonica cultivar-group)] (GB:NP_001043924.1); similar to C (GB:BAD82560.1); contains InterPro domain Esterase/lipase/thioesterase; (InterPro:IPR000379),71.85,341,5.00E-134,474,98.82697947Solyc03g043950.2.1,-1.262189161,5.420807627,0.039099499,Amino-acid N-acetyltransferase (AHRD V1 ***- D5W990_BURSC); contains Interpro domain(s)  IPR000182  GCN5-related N-acetyltransferase ,AT2G22910,NAGS1,GCN5-related N-acetyltransferase (GNAT) family protein / amino acid kinase family protein; similar to GCN5-related N-acetyltransferase (GNAT) family protein / amino acid kinase family protein [Arabidopsis thaliana] (TAIR:AT4G37670.2); similar to Os07g0585600 [Oryza sativa (japonica cultivar-group)] (GB:NP_001060125.1); similar to putative amino-acid N-acetyltransferase [Oryza sativa (japonica cultivar-group)] (GB:AAR87160.1); similar to Os03g0431200 [Oryza sativa (japonica cultivar-group)] (GB:NP_001050426.1); contains InterPro domain Aspartate/glutamate/uridylate kinase; (InterPro:IPR001048); contains InterPro domain Amino-acid N-acetyltransferase (ArgA); (InterPro:IPR010167); contains InterPro domain GCN5-related N-acetyltransferase; (InterPro:IPR000182),69.53,548,0,775,89.56953642Solyc03g044190.2.1,1.525880305,4.665469276,0.014346173,FAD-dependent oxidoreductase (AHRD V1 **-- A8ISJ7_CHLRE); contains Interpro domain(s)  IPR006076  FAD dependent oxidoreductase ,AT5G67290,NA,FAD-dependent oxidoreductase family protein; similar to Os07g0155100 [Oryza sativa (japonica cultivar-group)] (GB:NP_001058918.1); similar to D-amino acid oxidase [Zea mays] (GB:CAL58663.1); contains InterPro domain FAD dependent oxidoreductase; (InterPro:IPR006076); contains InterPro domain Aromatic-ring hydroxylase; (InterPro:IPR003042),70.17,352,1.00E-136,482,92.6121372Solyc03g046450.2.1,1.335336522,5.743963375,0.020878029,Cell morphogenesis protein (AHRD V1 *--- C0NPN9_AJECG); contains Interpro domain(s)  IPR016024  Armadillo-type fold ,AT5G15680,NA,binding; similar to hypothetical protein [Cleome spinosa] (GB:ABD96931.1); similar to hypothetical protein [Cleome spinosa] (GB:ABD96836.1); similar to hypothetical protein [Cleome spinosa] (GB:ABD96932.1); contains InterPro domain Armadillo-like helical; (InterPro:IPR011989),81.63,2156,0,3436,99.7148289Solyc03g051810.2.1,-1.682374491,4.092755229,0.015369685,Homogentisate phytyltransferase (AHRD V1 **-* D4ZR29_SPIPL); contains Interpro domain(s)  IPR000537  UbiA prenyltransferase ,AT3G11945,ATHST,"prenyltransferase; similar to HPT1 (HOMOGENTISATE PHYTYLTRANSFERASE 1), prenyltransferase [Arabidopsis thaliana] (TAIR:AT2G18950.1); similar to homogentisate phytyltransferase VTE2-2 [Glycine max] (GB:ABB70128.1); contains InterPro domain UbiA prenyltransferase; (InterPro:IPR000537)",69.23,325,2.00E-124,442,81.73652695Solyc03g051920.2.1,1.66944176,4.324029818,0.011783122,Os12g0581300 protein (Fragment) (AHRD V1 *-*- Q0IMB2_ORYSJ); contains Interpro domain(s)  IPR006873  Protein of unknown function DUF620 ,AT5G06610,NA,"similar to unknown protein [Arabidopsis thaliana] (TAIR:AT1G27690.1); similar to Lipase, putative, expressed [Oryza sativa (japonica cultivar-group)] (GB:ABA99131.1); contains InterPro domain Protein of unknown function DUF620; (InterPro:IPR006873)",59.43,350,2.00E-119,426,94.63276836Solyc03g058190.2.1,-1.208990646,5.509843877,0.048545234,Elongation factor family GTP-binding protein (AHRD V1 **** Q67QM4_SYMTH); contains Interpro domain(s)  IPR006298  GTP-binding protein TypA ,AT5G13650,NA,"elongation factor family protein; similar to GTP binding / translation elongation factor [Arabidopsis thaliana] (TAIR:AT2G31060.2); similar to Mitochondrial translation elongation factor Tu (ISS) [Ostreococcus tauri] (GB:CAL57456.1); similar to GTP-binding protein TypA [Trifolium pratense] (GB:AAR17698.1); similar to GTP-binding protein TypA [Herpetosiphon aurantiacus ATCC 23779] (GB:ZP_01425863.1); contains InterPro domain Small GTP-binding protein domain; (InterPro:IPR005225); contains InterPro domain Elongation factor G, III and V; (InterPro:IPR009022); contains InterPro domain Translation factor; (InterPro:IPR009000); contains InterPro domain Elongation factor Tu, domain 2; (InterPro:IPR004161); contains InterPro domain Elongation factor G, C-terminal; (InterPro:IPR000640); contains InterPro domain GTP-binding protein TypA; (InterPro:IPR006298); contains InterPro domain Protein synthesis factor, GTP-binding; (InterPro:IPR000795)",81.59,679,0,1141,99.70282318Solyc03g058470.1.1,1.653191379,4.060966877,0.01589142,TBC1 domain family member 15 (AHRD V1 *--- Q7TPU5_MOUSE); contains Interpro domain(s)  IPR000195  RabGAP/TBC ,AT2G43490,NA,RabGAP/TBC domain-containing protein; similar to RabGAP/TBC domain-containing protein [Arabidopsis thaliana] (TAIR:AT3G59570.1); similar to putative GTPase-activating protein [Oryza sativa (japonica cultivar-group)] (GB:BAD45492.1); contains InterPro domain RabGAP/TBC; (InterPro:IPR000195),52.17,600,2.00E-159,559,98.42657343Solyc03g059310.2.1,-1.528445364,4.423646946,0.022834757,"WD-40 repeat family protein (AHRD V1 **-- Q5D6Y8_GOSHI); contains Interpro domain(s)  IPR020472  G-protein beta WD-40 repeat, region ",AT3G18140,NA,nucleotide binding; similar to transducin family protein / WD-40 repeat family protein [Arabidopsis thaliana] (TAIR:AT2G22040.1); similar to WD40 repeat-containing protein [Dictyostelium discoideum AX4] (GB:XP_629512.1); similar to Os03g0681700 [Oryza sativa (japonica cultivar-group)] (GB:NP_001050907.1); contains InterPro domain WD-40 repeat; (InterPro:IPR001680); contains InterPro domain WD40-like; (InterPro:IPR011046),85.96,228,3.00E-117,417,96.59574468Solyc03g063320.2.1,1.558378186,4.690683685,0.015115253,Zinc transporter like 1 (AHRD V1 ***- Q9JKN2_MOUSE); contains Interpro domain(s)  IPR002524  Cation efflux protein ,AT3G12100,NA,"cation efflux family protein / metal tolerance protein, putative; Identical to Metal tolerance protein C2 (AtMTPc2) (MTPC2) [Arabidopsis Thaliana] (GB:Q6ICY4;GB:Q9C7C2;GB:Q9LH56); similar to cation efflux family protein [Arabidopsis thaliana] (TAIR:AT2G04620.1); similar to Os02g0832700 [Oryza sativa (japonica cultivar-group)] (GB:NP_001048630.1); similar to PREDICTED: similar to zinc transporter ZTL1 isoform 1 isoform 3 [Bos taurus] (GB:XP_878682.1); contains InterPro domain Cation efflux protein; (InterPro:IPR002524)",72.22,360,1.00E-148,522,89.69072165Solyc03g077920.1.1,1.745925414,2.821105397,0.030256306,"Phosphoribosylanthranilate transferase (Fragment) (AHRD V1 *--- Q43085_PEA); contains Interpro domain(s)  IPR013583  Phosphoribosyltransferase C-terminal, plant ",AT5G06850,NA,"C2 domain-containing protein; similar to C2 domain-containing protein [Arabidopsis thaliana] (TAIR:AT5G48060.1); similar to C2 domain-containing protein [Arabidopsis thaliana] (TAIR:AT1G51570.1); similar to C2 domain-containing protein [Arabidopsis thaliana] (TAIR:AT3G57880.1); similar to H0305E08.5 [Oryza sativa (indica cultivar-group)] (GB:CAH67434.1); similar to C2 [Medicago truncatula] (GB:ABE89860.1); similar to C2 [Medicago truncatula] (GB:ABE85066.1); contains InterPro domain C2; (InterPro:IPR000008); contains InterPro domain Phosphoribosyltransferase C-terminal, plant; (InterPro:IPR013583); contains InterPro domain C2 calcium/lipid-binding region, CaLB; (InterPro:IPR008973)",78.59,794,0,1314,99.74683544Solyc03g078650.2.1,2.244039502,3.339676545,0.008327834,Os12g0581300 protein (Fragment) (AHRD V1 *-*- Q0IMB2_ORYSJ); contains Interpro domain(s)  IPR006873  Protein of unknown function DUF620 ,AT5G05840,NA,similar to unknown protein [Arabidopsis thaliana] (TAIR:AT3G55720.1); similar to hypothetical protein [Oryza sativa (japonica cultivar-group)] (GB:AAP06886.1); similar to Os03g0267500 [Oryza sativa (japonica cultivar-group)] (GB:NP_001049665.1); contains InterPro domain Protein of unknown function DUF620; (InterPro:IPR006873),63.13,434,2.00E-150,528,96.19952494