ITAG,logFC,logCPM,PValue,SGN_annotation,AGI,symbol,gene_name,X..identity,alignment.length,e.value,bit.score,percent.query.alignSolyc09g074900.2.1,-1.826996462,4.744165643,0.00250571,"Dolichyl-P-Man Man5GlcNAc2-PP-dolichyl mannosyltransferase (AHRD V1 **** C0H8S4_SALSA); contains Interpro domain(s)  IPR007873  Glycosyltransferase, ALG3 ",AT2G47760,ALG3,ALG3 family protein; similar to Mannosyltransferase (ISS) [Ostreococcus tauri] (GB:CAL57845.1); contains InterPro domain ALG3; (InterPro:IPR007873),67.76,425,1.00E-142,503,97.46543779Solyc09g075170.1.1,2.682129898,4.793981408,3.83E-05,Pentatricopeptide repeat protein (AHRD V1 ***- D2STE4_GOSHI); contains Interpro domain(s)  IPR002885  Pentatricopeptide repeat ,AT3G62890,NA,binding; similar to binding [Arabidopsis thaliana] (TAIR:AT5G40405.1); similar to Os01g0176300 [Oryza sativa (japonica cultivar-group)] (GB:NP_001042180.1); similar to Asp/Glu racemase; Tetratricopeptide-like helical [Medicago truncatula] (GB:ABE83029.1); contains InterPro domain Pentatricopeptide repeat; (InterPro:IPR002885); contains InterPro domain Tetratricopeptide-like helical; (InterPro:IPR011990),55.36,448,2.00E-146,516,98Solyc09g075350.2.1,1.864829293,6.052963858,0.001318039,"Pectinesterase (AHRD V1 ***- B9SAU4_RICCO); contains Interpro domain(s)  IPR000070  Pectinesterase, catalytic ",AT4G02320,NA,"pectinesterase family protein; similar to pectinesterase family protein [Arabidopsis thaliana] (TAIR:AT4G02300.1); similar to Os01g0312500 [Oryza sativa (japonica cultivar-group)] (GB:NP_001042866.1); similar to putative thermostable pectinesterase [Citrus sinensis] (GB:AAK84485.1); similar to Os07g0675100 [Oryza sativa (japonica cultivar-group)] (GB:NP_001060620.1); contains InterPro domain Virulence factor, pectin lyase fold; (InterPro:IPR011050); contains InterPro domain Plant invertase/pectin methylesterase inhibitor; (InterPro:IPR007186); contains InterPro domain Pectinesterase; (InterPro:IPR000070); contains InterPro domain Pectinesterase inhibitor; (InterPro:IPR006501)",54.24,483,3.00E-149,525,82.59325044Solyc09g075360.2.1,-1.317087054,8.263764574,0.028962646,"Endoglucanase 1 (AHRD V1 ***- B6U0P7_MAIZE); contains Interpro domain(s)  IPR008928  Six-hairpin glycosidase-like  IPR012341  Six-hairpin glycosidase  IPR018221  Glycoside hydrolase, family 9, active site  IPR001701  Glycoside hydrolase, family 9 ",AT4G02290,AtGH9B13,"glycosyl hydrolase family 9 protein; Identical to Endoglucanase 17 precursor (EC 3.2.1.4) (Endo-1,4-beta glucanase 17) [Arabidopsis Thaliana] (GB:O81416); similar to ATCEL2 (Arabidopsis thaliana Cellulase 2), hydrolase, hydrolyzing O-glycosyl compounds [Arabidopsis thaliana] (TAIR:AT1G02800.1); similar to endo-1,4-beta-glucanase [Pisum sativum] (GB:BAA85150.1); similar to endo-1,4-beta-glucanase precursor (GB:AAA80495.1); similar to Endoglucanase 3 precursor (Endo-1,4-beta glucanase 3) (OsGLU8) (GB:Q8LQ92); contains InterPro domain Six-hairpin glycosidase; (InterPro:IPR008928); contains InterPro domain Glycoside transferase, six-hairpin, subgroup; (InterPro:IPR012343); contains InterPro domain Glycoside hydrolase, family 9; (InterPro:IPR001701)",79.32,469,0,774,91.5851272Solyc09g075730.2.1,2.386938361,5.218490265,0.000154821,"LRR receptor-like serine/threonine-protein kinase, RLP",AT3G05990,NA,"leucine-rich repeat family protein; similar to leucine-rich repeat family protein [Arabidopsis thaliana] (TAIR:AT3G19230.1); similar to Os03g0184400 [Oryza sativa (japonica cultivar-group)] (GB:NP_001049189.1); similar to Putative protein with similarity to putative protein kinases [Oryza sativa] (GB:AAK92623.1); contains InterPro domain Leucine-rich repeat; (InterPro:IPR001611); contains InterPro domain Leucine-rich repeat, plant specific; (InterPro:IPR007090); contains InterPro domain Leucine rich repeat, N-terminal; (InterPro:IPR013210)",56.91,492,1.00E-165,580,95.1171875Solyc09g075900.2.1,-2.05802016,5.579117571,0.00327927,Spermidine synthase (AHRD V1 **** D5MHP1_9BACT); contains Interpro domain(s)  IPR001045  Spermine synthase ,AT5G19530,ACL5,"Encodes a spermine synthase.  Required for internode elongation and vascular development, specifically in the mechanism that defines the boundaries between veins and nonvein regions.   This mechanism may be mediated by polar auxin transport.  Though ACL5 has been shown to function as a spermine  synthase in E. coli, an ACL5 knockout has no effect on the endogenous levels of free and conjugated polyamines in Arabidopsis, suggesting that ACL5 may have a very specific or altogether different in vivo function.",68.56,299,5.00E-130,461,89.75903614Solyc09g075950.1.1,-3.403890361,2.826068648,0.011482133,Heat shock protein 1 (AHRD V1 ***- B6SXY0_MAIZE); contains Interpro domain(s)  IPR013126  Heat shock protein 70 ,AT2G32120,HSP70T-2,"HSP70T-2; ATP binding; similar to HSP70 (heat shock protein 70), ATP binding [Arabidopsis thaliana] (TAIR:AT3G12580.1); similar to Heat shock protein Hsp70 [Medicago truncatula] (GB:ABE91718.1); similar to Os03g0218500 [Oryza sativa (japonica cultivar-group)] (GB:NP_001049397.1); contains InterPro domain Heat shock protein Hsp70; (InterPro:IPR001023); contains InterPro domain Heat shock protein 70; (InterPro:IPR013126)",70.63,572,0,825,98.6135182Solyc09g082450.1.1,2.411020233,5.251955751,8.72E-05,Pentatricopeptide repeat-containing protein (AHRD V1 ***- D7KMD0_ARALY); contains Interpro domain(s)  IPR002885  Pentatricopeptide repeat ,AT3G22690,NA,pentatricopeptide (PPR) repeat-containing protein; similar to pentatricopeptide (PPR) repeat-containing protein [Arabidopsis thaliana] (TAIR:AT2G29760.1); similar to pentatricopeptide (PPR) repeat-containing protein [Arabidopsis thaliana] (TAIR:AT5G16860.1); similar to Tetratricopeptide-like helical [Medicago truncatula] (GB:ABE88530.1); contains InterPro domain Pentatricopeptide repeat; (InterPro:IPR002885); contains InterPro domain Protein of unknown function DUF1685; (InterPro:IPR012881); contains InterPro domain Protein prenyltransferase; (InterPro:IPR008940); contains InterPro domain Tetratricopeptide-like helical; (InterPro:IPR011990),57.86,814,0,981,96.77804296Solyc09g082630.2.1,1.463622774,5.799341178,0.011951456,"Acireductone dioxygenase (AHRD V1 **** Q08G57_PLAMJ); contains Interpro domain(s)  IPR004313  Acireductone dioxygenase, ARD ",AT5G43850,ARD4,"ATARD4; acireductone dioxygenase (Fe2+-requiring)/ metal ion binding; Identical to 1,2-dihydroxy-3-keto-5-methylthiopentene dioxygenase 4 (EC 1.13.-.-) (Aci-reductone dioxygenase 4) (ARD4) [Arabidopsis Thaliana] (GB:Q8H185;GB:Q8LCE2;GB:Q9FG79); similar to ATARD2, metal ion binding [Arabidopsis thaliana] (TAIR:AT4G14710.2); similar to ARD-like protein [Brassica juncea] (GB:AAR03591.1); contains InterPro domain Cupin, RmlC-type; (InterPro:IPR011051); contains InterPro domain Cupin region; (InterPro:IPR007113); contains InterPro domain Acireductone dioxygenase, ARD; (InterPro:IPR004313)",75.66,189,1.00E-84,308,98.94736842Solyc09g082660.2.1,1.590768705,4.94033564,0.011557049,"Caffeoyl-CoA O-methyltransferase (AHRD V1 **** A9X9L7_BAMOL); contains Interpro domain(s)  IPR002935  O-methyltransferase, family 3 ",AT1G67980,CCOAMT,Encodes S-adenosyl-L-methionine: transcaffeoyl Coenzyme A 3-O-methyltransferase.,64.1,234,6.00E-75,276,98.72881356Solyc09g083050.2.1,1.743590634,5.261504886,0.00419362,Fatty acid elongase 3-ketoacyl-CoA synthase (AHRD V1 **** Q6DUV5_BRANA); contains Interpro domain(s)  IPR012392  Very-long-chain 3-ketoacyl-CoA synthase ,AT2G26640,KCS11,"beta-ketoacyl-CoA synthase, putative; Identical to 3-ketoacyl-CoA synthase 11 (EC 2.3.1.-) (EC 2.3.1.119) (KCS-11) (Very- long-chain fatty acid condensing enzyme 11) (VLCFA condensing enzyme 11) (KCS11) [Arabidopsis Thaliana] (GB:O48780); similar to beta-ketoacyl-CoA synthase, putative [Arabidopsis thaliana] (TAIR:AT5G43760.1); similar to beta-ketoacyl-CoA synthase, putative [Arabidopsis thaliana] (TAIR:AT1G04220.1); similar to very-long-chain fatty acid condensing enzyme, putative [Arabidopsis thaliana] (TAIR:AT1G19440.1); similar to fatty acid elongase 1-like protein [Limnanthes douglasii] (GB:AAG28600.1); similar to beta-ketoacyl-CoA-synthase [Marchantia polymorpha] (GB:AAO48425.1); similar to putative fatty acid elongase [Zea mays] (GB:CAC01441.1); contains InterPro domain FAE1/Type III polyketide synthase-like protein; (InterPro:IPR013601); contains InterPro domain Very-long-chain 3-ketoacyl-CoA synthase; (InterPro:IPR012392); contains InterPro domain Chalcone and stilbene synthases, C-terminal; (InterPro:IPR012328)",75.98,508,0,835,98.6381323Solyc09g090510.2.1,1.426075225,6.872619361,0.01125489,Cyclopropane-fatty-acyl-phospholipid synthase (AHRD V1 *-*- C7LRK7_DESBD); contains Interpro domain(s)  IPR003333  Cyclopropane-fatty-acyl-phospholipid synthase ,AT3G23530,NA,"cyclopropane fatty acid synthase, putative / CPA-FA synthase, putative; similar to cyclopropane fatty acid synthase-related [Arabidopsis thaliana] (TAIR:AT3G23480.1); similar to cyclopropane-fatty-acyl-phospholipid synthase [Arabidopsis thaliana] (TAIR:AT3G23470.1); similar to cyclopropane fatty acid synthase, putative / CPA-FA synthase, putative [Arabidopsis thaliana] (TAIR:AT3G23510.1); similar to cyclopropane fatty acid synthase [Gossypium hirsutum] (GB:AAT74601.1); similar to cyclopropane synthase [Sterculia foetida] (GB:AAM33848.1); similar to cyclopropane fatty acid synthase [Gossypium hirsutum] (GB:AAT74602.1); contains InterPro domain NAD-binding site; (InterPro:IPR000205); contains InterPro domain Adrenodoxin reductase; (InterPro:IPR000759); contains InterPro domain Cyclopropane-fatty-acyl-phospholipid synthase; (InterPro:IPR003333); contains InterPro domain SAM (and some other nucleotide) binding motif; (InterPro:IPR000051); contains InterPro domain Amine oxidase; (InterPro:IPR002937)",74.19,864,0,1353,99.76825029Solyc09g091260.2.1,1.198071597,5.379649699,0.042471649,"Receptor like kinase, RLK",AT5G63930,NA,"leucine-rich repeat transmembrane protein kinase, putative; similar to leucine-rich repeat transmembrane protein kinase, putative [Arabidopsis thaliana] (TAIR:AT2G33170.1); similar to leucine-rich repeat transmembrane protein kinase, putative [Arabidopsis thaliana] (TAIR:AT1G34110.1); similar to leucine-rich repeat family protein / protein kinase family protein [Arabidopsis thaliana] (TAIR:AT1G17230.1); similar to Leucine Rich Repeat family protein [Solanum demissum] (GB:AAT40539.2); similar to Receptor-like protein kinase precursor (GB:P93194); similar to putative LRR receptor-like kinase [Oryza sativa (japonica cultivar-group)] (GB:BAC84715.1); contains InterPro domain Protein kinase-like; (InterPro:IPR011009); contains InterPro domain Leucine-rich repeat; (InterPro:IPR001611); contains InterPro domain Protein kinase; (InterPro:IPR000719); contains InterPro domain Leucine-rich repeat, plant specific; (InterPro:IPR007090); contains InterPro domain Serine/threonine protein kinase, active site; (InterPro:IPR008271); contains InterPro domain Leucine rich repeat, N-terminal; (InterPro:IPR013210)",64.35,1066,0,1246,95.4012624Solyc09g091400.2.1,-1.524633501,4.46667006,0.016669809,"Receptor like kinase, RLK",AT3G24240,NA,"leucine-rich repeat transmembrane protein kinase, putative; similar to protein kinase family protein [Arabidopsis thaliana] (TAIR:AT4G26540.1); similar to leucine-rich repeat transmembrane protein kinase, putative [Arabidopsis thaliana] (TAIR:AT5G48940.1); similar to ATP binding / protein serine/threonine kinase [Arabidopsis thaliana] (TAIR:AT5G56040.2); similar to clavata-like kinase [Brachypodium sylvaticum] (GB:CAJ26360.1); similar to receptor protein kinase [Pinus sylvestris] (GB:CAC20842.1); similar to CLAVATA-like kinase [Triticum aestivum] (GB:CAJ19346.1); contains InterPro domain Protein kinase-like; (InterPro:IPR011009); contains InterPro domain Leucine-rich repeat; (InterPro:IPR001611); contains InterPro domain Protein kinase; (InterPro:IPR000719); contains InterPro domain Leucine-rich repeat, plant specific; (InterPro:IPR007090); contains InterPro domain Serine/threonine protein kinase, active site; (InterPro:IPR008271); contains InterPro domain Leucine rich repeat, N-terminal; (InterPro:IPR013210)",70.16,1069,0,1395,94.32624113Solyc09g091560.2.1,1.149456263,6.231583036,0.043915958,Ankyrin repeat domain-containing protein 13C-A (AHRD V1 *-*- C0H9Z7_SALSA); contains Interpro domain(s)  IPR002110  Ankyrin ,AT1G04780,NA,ankyrin repeat family protein; similar to ankyrin repeat family protein [Arabidopsis thaliana] (TAIR:AT3G24210.1); similar to unknown protein [Arabidopsis thaliana] (TAIR:AT3G04470.1); similar to Os02g0810100 [Oryza sativa (japonica cultivar-group)] (GB:NP_001048467.1); similar to Os07g0436100 [Oryza sativa (japonica cultivar-group)] (GB:NP_001059505.1); similar to hypothetical protein [Oryza sativa (japonica cultivar-group)] (GB:BAC80109.1); contains InterPro domain Ankyrin; (InterPro:IPR002110),68.94,644,0,855,95.86523737Solyc09g092440.1.1,1.875469833,3.42059391,0.010927557,Pentatricopeptide repeat-containing protein (AHRD V1 ***- D7LCN4_ARALY); contains Interpro domain(s)  IPR002885  Pentatricopeptide repeat ,AT4G14050,NA,"pentatricopeptide (PPR) repeat-containing protein; similar to pentatricopeptide (PPR) repeat-containing protein [Arabidopsis thaliana] (TAIR:AT1G68930.1); similar to Os11g0661000 [Oryza sativa (japonica cultivar-group)] (GB:NP_001068407.1); similar to pentatricopeptide, putative, expressed [Oryza sativa (japonica cultivar-group)] (GB:ABG22571.1); contains InterPro domain Pentatricopeptide repeat; (InterPro:IPR002885); contains InterPro domain Protein prenyltransferase; (InterPro:IPR008940); contains InterPro domain Tetratricopeptide-like helical; (InterPro:IPR011990)",61.74,609,0,756,99.01800327Solyc09g098090.2.1,-1.623497483,2.586302049,0.049291464,Aldo/keto reductase (AHRD V1 **** A2Q5A8_MEDTR); contains Interpro domain(s)  IPR001395  Aldo/keto reductase ,AT1G60690,NA,"aldo/keto reductase family protein; similar to ATB2, oxidoreductase [Arabidopsis thaliana] (TAIR:AT1G60710.1); similar to aldo/keto reductase AKR [Manihot esculenta] (GB:AAX84672.1); contains InterPro domain Aldo/keto reductase; (InterPro:IPR001395)",69.14,337,5.00E-140,494,96.82080925Solyc09g098220.2.1,2.142062609,3.81587234,0.001502447,Mitotic spindle checkpoint component mad2 (AHRD V1 ***- MAD2_SCHPO); contains Interpro domain(s)  IPR003511  DNA-binding HORMA ,AT1G16590,ATREV7,"putative translesion synthesis polymerase zeta subunit, homologous to Y-family DNA polymerases, contains BRCT domain. Mutants are sensitive to UV-B radiation. Gene is involved in damage-tolerance mechanisms through translesion synthesis(TLS).",66.83,199,2.00E-78,288,97.53694581Solyc10g005000.2.1,-1.592944693,3.99158675,0.020379449,Os03g0648300 protein (Fragment) (AHRD V1 *--- Q0DPZ6_ORYSJ); contains Interpro domain(s)  IPR000048  IQ calmodulin-binding region ,AT1G01110,IQD18,"IQD18 (IQ-domain 18); similar to IQD17 (IQ-domain 17), calmodulin binding [Arabidopsis thaliana] (TAIR:AT4G00820.1); similar to putative SF16 protein [Oryza sativa (japonica cultivar-group)] (GB:AAV33309.1); similar to Os08g0115200 [Oryza sativa (japonica cultivar-group)] (GB:NP_001060851.1); similar to Os01g0833800 [Oryza sativa (japonica cultivar-group)] (GB:NP_001044716.1)",50.87,403,5.00E-72,268,84.81012658Solyc10g005370.2.1,-1.786596739,3.047543596,0.015576946,"Pyruvate, phosphate dikinase regulatory protein 2 (AHRD V1 ***- PDRP2_ARATH); contains Interpro domain(s)  IPR005177  Protein of unknown function DUF299 ",AT4G21210,ATRP1,Identical to UPF0085 protein At4g21210 [Arabidopsis Thaliana] (GB:O49562); similar to unknown protein [Arabidopsis thaliana] (TAIR:AT3G01200.1); similar to putative ATP/GTP-binding protein [Oryza sativa (japonica cultivar-group)] (GB:BAC45149.1); contains InterPro domain Protein of unknown function DUF299; (InterPro:IPR005177),61.76,387,9.00E-133,470,95.2020202Solyc10g005670.1.1,-1.29258181,7.387676099,0.027124823,Regulator of ribonuclease activity A (AHRD V1 ***- B6T0A4_MAIZE); contains Interpro domain(s)  IPR005493  Ribonuclease E inhibitor RraA/Dimethylmenaquinone methyltransferase ,AT5G56260,NA,dimethylmenaquinone methyltransferase family protein; Identical to Regulator of ribonuclease-like protein 3 [Arabidopsis Thaliana] (GB:Q9FH13;GB:Q53XH2); similar to dimethylmenaquinone methyltransferase family protein [Arabidopsis thaliana] (TAIR:AT5G16450.2); similar to S-adenosylmethionine:2-demethylmenaquinone methyltransferase-like [Oryza sativa (japonica cultivar-group)] (GB:BAB84438.1); contains InterPro domain Protein of unknown function 1935; (InterPro:IPR010203); contains InterPro domain Dimethylmenaquinone methyltransferase; (InterPro:IPR005493),79.35,92,4.00E-40,159,97.84946237Solyc10g005880.2.1,-1.32983092,5.299276528,0.032397928,Uridine kinase (AHRD V1 **** B9S0W5_RICCO); contains Interpro domain(s)  IPR000764  Uridine kinase ,AT1G55810,UKL3,"uracil phosphoribosyltransferase, putative / UMP pyrophosphorylase, putative / UPRTase, putative; similar to ATUK/UPRT1, ATP binding / kinase/ uracil phosphoribosyltransferase/ uridine kinase [Arabidopsis thaliana] (TAIR:AT5G40870.1); similar to uracil phosphoribosyltransferase, putative / UMP pyrophosphorylase, putative / UPRTase, putative [Arabidopsis thaliana] (TAIR:AT3G27190.1); similar to uracil phosphoribosyltransferase / UMP pyrophosphorylase (UPT1) [Arabidopsis thaliana] (TAIR:AT4G26510.2); similar to Phosphoribosyltransferase; AAA ATPase; Phosphoribulokinase/uridine kinase [Medicago truncatula] (GB:ABE83101.1); similar to Os02g0273000 [Oryza sativa (japonica cultivar-group)] (GB:NP_001046530.1); similar to Os11g0265000 [Oryza sativa (japonica cultivar-group)] (GB:NP_001067657.1); contains InterPro domain Phosphoribulokinase/uridine kinase; (InterPro:IPR006083); contains InterPro domain Uridine kinase; (InterPro:IPR000764); contains InterPro domain Phosphoribosyltransferase; (InterPro:IPR000836)",88.52,418,0,744,98.58156028Solyc10g005950.2.1,-1.285755967,5.447870391,0.032801304,Nudix hydrolase 2 (AHRD V1 **-- B6U183_MAIZE); contains Interpro domain(s)  IPR000086  NUDIX hydrolase domain ,AT5G47650,ATNUDT2,"ATNUDT2 (Arabidopsis thaliana Nudix hydrolase homolog 2); ADP-ribose diphosphatase/ NAD binding / hydrolase; Identical to Nudix hydrolase 2 (EC 3.6.1.-) (AtNUDT2) (ADP-ribose pyrophosphatase) (EC 3.6.1.13) (NADH pyrophosphatase) (EC 3.6.1.22) (NUDT2) [Arabidopsis Thaliana] (GB:Q94B74;GB:Q9FGJ2); similar to ATNUDT10 (ARABIDOPSIS THALIANA NUDIX HYDROLASE HOMOLOG 10), catalytic [Arabidopsis thaliana] (TAIR:AT4G25434.1); similar to hydrolase, NUDIX family protein [Brassica oleracea] (GB:ABD64992.1); contains InterPro domain NUDIX hydrolase; (InterPro:IPR000086); contains InterPro domain Anti-sense to fibroblast growth factor protein GFG; (InterPro:IPR003293)",60.55,256,2.00E-95,345,90.42553191Solyc10g005990.2.1,1.945369318,6.382119364,0.000672931,Tuftelin interacting protein 11 (AHRD V1 ***- Q8N523_HUMAN); contains Interpro domain(s)  IPR014809  Tuftelin interacting protein 11 ,AT1G17070,NA,D111/G-patch domain-containing protein; similar to D111/G-patch domain-containing protein [Arabidopsis thaliana] (TAIR:AT2G42330.2); similar to PREDICTED: similar to Tuftelin-interacting protein 11 isoform 1 [Canis familiaris] (GB:XP_534724.1); similar to Os12g0615800 [Oryza sativa (japonica cultivar-group)] (GB:NP_001067277.1); contains InterPro domain D111/G-patch; (InterPro:IPR000467),56.79,722,0,789,84.71563981Solyc10g006020.2.1,-1.427067477,5.15201766,0.012405187,Mitochondrial import inner membrane translocase subunit tim50 (AHRD V1 *--- C8V8E4_EMENI); contains Interpro domain(s)  IPR004274  NLI interacting factor ,AT1G55900,TIM50,component of a translocase in the mitochondrial inner membrane,60.8,301,6.00E-101,364,82.5Solyc10g006040.1.1,1.143445263,6.047765169,0.046725155,Serine acetyltransferase (AHRD V1 **** Q39533_CITLA); contains Interpro domain(s)  IPR005881  Serine O-acetyltransferase ,AT3G13110,ATSERAT2;2,Encodes a mitochondrial serine O-acetyltransferase involved in sulfur assimilation and cysteine biosynthesis. Expressed in the vascular system.,61.88,341,6.00E-111,397,91.2568306Solyc10g006510.2.1,1.369113308,3.734184652,0.044434322,Transcription factor (Fragment) (AHRD V1 **** D6MKL1_9ASPA); contains Interpro domain(s)  IPR011598  Helix-loop-helix DNA-binding ,AT5G54680,ILR3,ILR3 (IAA-LEUCINE RESISTANT3); DNA binding / transcription factor; similar to basic helix-loop-helix (bHLH) family protein [Arabidopsis thaliana] (TAIR:AT1G51070.1); similar to Prefoldin; Helix-loop-helix DNA-binding [Medicago truncatula] (GB:ABE93168.1); contains InterPro domain Helix-loop-helix DNA-binding; (InterPro:IPR011598); contains InterPro domain Basic helix-loop-helix dimerisation region bHLH; (InterPro:IPR001092),67.65,238,1.00E-72,269,99.13793103Solyc10g006660.2.1,-2.279873041,4.167706958,0.033609057,Calcium-binding EF hand family protein (Fragment) (AHRD V1 **-- D7MEH5_ARALY); contains Interpro domain(s)  IPR011992  EF-Hand type ,AT4G27280,NA,"calcium-binding EF hand family protein; similar to PBP1 (PINOID-BINDING PROTEIN 1), calcium ion binding [Arabidopsis thaliana] (TAIR:AT5G54490.1); similar to Avr9/Cf-9 rapidly elicited protein 20 [Nicotiana tabacum] (GB:AAV92890.1); contains InterPro domain EF-Hand type; (InterPro:IPR011992); contains InterPro domain Calcium-binding EF-hand; (InterPro:IPR002048)",66.07,112,7.00E-34,139,84.61538462Solyc10g006860.2.1,-2.087103312,3.70707612,0.009116706,Dehydrogenase/reductase SDR family protein 7-like (AHRD V1 **-- DHRS7_DROME); contains Interpro domain(s)  IPR002347  Glucose/ribitol dehydrogenase ,AT2G17845,NA,short-chain dehydrogenase/reductase (SDR) family protein; similar to short-chain dehydrogenase/reductase (SDR) family protein [Arabidopsis thaliana] (TAIR:AT3G55290.1); similar to putative short-chain type alcohol dehydrogenase [Solanum tuberosum] (GB:AAN32641.1); contains InterPro domain Short-chain dehydrogenase/reductase SDR; (InterPro:IPR002198); contains InterPro domain Glucose/ribitol dehydrogenase; (InterPro:IPR002347),62.08,269,3.00E-88,321,96.75090253Solyc10g006900.2.1,-1.543416932,6.18240658,0.01042781,Protochlorophyllide reductase (AHRD V1 ***- Q8LAV9_ARATH); contains Interpro domain(s)  IPR005979  Light-dependent protochlorophyllide reductase ,AT4G27440,PORB,light-dependent NADPH:protochlorophyllide oxidoreductase B,80.3,401,0,632,99.49494949Solyc10g007520.1.1,2.522635409,3.615358422,0.000484868,Pentatricopeptide repeat-containing protein (AHRD V1 ***- D7MSM5_ARALY); contains Interpro domain(s)  IPR002885  Pentatricopeptide repeat ,AT3G14580,NA,pentatricopeptide (PPR) repeat-containing protein; similar to pentatricopeptide (PPR) repeat-containing protein [Arabidopsis thaliana] (TAIR:AT5G46100.1); similar to OSJNBa0058K23.3 [Oryza sativa (japonica cultivar-group)] (GB:CAE02149.2); similar to H0313F03.9 [Oryza sativa (indica cultivar-group)] (GB:CAJ86125.1); contains InterPro domain Pentatricopeptide repeat; (InterPro:IPR002885); contains InterPro domain Protein prenyltransferase; (InterPro:IPR008940); contains InterPro domain Tetratricopeptide-like helical; (InterPro:IPR011990),55.52,335,1.00E-116,416,86.08247423Solyc10g007660.2.1,2.687225062,3.554229924,0.000743199,"UPF0497 membrane protein 11 (AHRD V1 ***- U497B_VITVI); contains Interpro domain(s)  IPR006459  Uncharacterised protein family UPF0497, trans-membrane plant subgroup ",AT1G17200,NA,"integral membrane family protein; similar to integral membrane family protein [Arabidopsis thaliana] (TAIR:AT3G14380.1); similar to hypothetical protein [Gossypium hirsutum] (GB:CAC84114.1); contains InterPro domain Protein of unknown function DUF588; (InterPro:IPR006702); contains InterPro domain Conserved hypothetical protein CHP1569, integral membrane plant; (InterPro:IPR006459)",63.82,152,6.00E-56,213,78.94736842Solyc10g007680.2.1,2.805858581,4.621500475,2.50E-05,Regulator of chromosome condensation RCC1 (AHRD V1 **-- B9MQV6_ANATD); contains Interpro domain(s)  IPR009091  Regulator of chromosome condensation/beta-lactamase-inhibitor protein II ,AT5G48330,NA,"regulator of chromosome condensation (RCC1) family protein; similar to UVR8 (UVB-RESISTANCE 8) [Arabidopsis thaliana] (TAIR:AT5G63860.1); similar to Os02g0197500 [Oryza sativa (japonica cultivar-group)] (GB:NP_001046199.1); similar to BNR repeat domain protein [Stigmatella aurantiaca DW4/3-1] (GB:ZP_01462040.1); contains InterPro domain Regulator of chromosome condensation, RCC1; (InterPro:IPR000408); contains InterPro domain Regulator of chromosome condensation/beta-lactamase-inhibitor protein II; (InterPro:IPR009091)",62.33,430,1.00E-148,523,95.72072072Solyc10g007830.1.1,2.160638264,6.562633118,0.000187789,"LRR receptor-like serine/threonine-protein kinase, RLP",AT2G42800,AtRLP29,"leucine-rich repeat family protein; similar to TMM (TOO MANY MOUTHS), protein binding [Arabidopsis thaliana] (TAIR:AT1G80080.1); similar to unknown protein [Oryza sativa (japonica cultivar-group)] (GB:AAS72353.1); similar to putative leucine-rich repeat protein [Oryza sativa (japonica cultivar-group)] (GB:AAT47071.1); contains InterPro domain Leucine-rich repeat; (InterPro:IPR001611); contains InterPro domain Leucine-rich repeat, plant specific; (InterPro:IPR007090)",64.52,389,8.00E-118,420,86.00451467Solyc10g008600.2.1,1.736284131,5.762335101,0.003290129,Unknown Protein (AHRD V1),AT4G28210,emb1923,EMB1923 (EMBRYO DEFECTIVE 1923),53.87,336,4.00E-85,311,91.29213483Solyc10g008880.2.1,1.912857597,4.163774227,0.003720015,One zinc finger protein (AHRD V1 **-- Q75PR0_PHYPA),AT1G28520,ATVOZ1,"similar to unknown protein [Arabidopsis thaliana] (TAIR:AT2G42400.1); similar to putative vascular plant one zinc finger protein [Oryza sativa (japonica cultivar-group)] (GB:BAD87186.1); contains InterPro domain Colicin E3, catalytic; (InterPro:IPR009105)",65.76,476,8.00E-159,556,93.72384937